{
  "schemaVersion": "1.0.0",
  "fixture": {
    "id": "diff-coalescing",
    "snapshot": "before",
    "packageName": "@tadori-fixtures/diff-coalescing",
    "purpose": "Before snapshot for rename/move and graph-diff coalescing tests.",
    "relationStrata": [
      "contains",
      "imports",
      "exports",
      "references",
      "calls"
    ],
    "nastyCases": [
      "Pre-move helper path",
      "Pre-rename formatter method",
      "Heuristic Resolver.resolve call through any",
      "Audit call that will be removed"
    ],
    "indexedFiles": [
      "src/task.ts",
      "src/audit.ts",
      "src/notifier.ts",
      "src/formatter.ts",
      "src/resolver.ts",
      "src/legacy/helper.ts"
    ],
    "supportFiles": [
      "package.json",
      "tsconfig.json"
    ]
  },
  "analyzerContract": {
    "constructorsAreNodes": false
  },
  "nodes": [
    {
      "id": "pkg:root",
      "kind": "package",
      "qualifiedName": "@tadori-fixtures/diff-coalescing",
      "displayName": "@tadori-fixtures/diff-coalescing",
      "canonicalIdentity": "node|package|@tadori-fixtures/diff-coalescing",
      "entityKey": "b6d828141f3d2c67045e16e8311a82251a9abb5d7626a7f129c0590e61391a11",
      "file": null,
      "exported": false
    },
    {
      "id": "file:src/task.ts",
      "kind": "file",
      "qualifiedName": "src/task.ts",
      "displayName": "task.ts",
      "canonicalIdentity": "node|file|src/task.ts",
      "entityKey": "7597f6a1fedf2bf59237174bb751f46d1c25869a2dea649daa88e133eaf686ed",
      "file": "src/task.ts",
      "exported": false,
      "bodyHash": "6a4c4b8155c85dbedade848ea8296215bae2c39b54ac5a0fa50fdbad4595fc68"
    },
    {
      "id": "file:src/audit.ts",
      "kind": "file",
      "qualifiedName": "src/audit.ts",
      "displayName": "audit.ts",
      "canonicalIdentity": "node|file|src/audit.ts",
      "entityKey": "0afb134943a90ce07f837cebac18849b2a8e9ecf9a892324dcbaf230c9f225ad",
      "file": "src/audit.ts",
      "exported": false,
      "bodyHash": "5e6a28a4b8618b2908e8355ba76ccc90ba1df2b07f44205a1e613f5fdd94bfe8"
    },
    {
      "id": "file:src/notifier.ts",
      "kind": "file",
      "qualifiedName": "src/notifier.ts",
      "displayName": "notifier.ts",
      "canonicalIdentity": "node|file|src/notifier.ts",
      "entityKey": "9839cee9dbdf6f2405b80aee5694096b70cb89bc17b16b7e7747eb93432d89bd",
      "file": "src/notifier.ts",
      "exported": false,
      "bodyHash": "be58871c1044dbd4d630e66e1a269ee580fc48f519c744a58b1645c141c45c23"
    },
    {
      "id": "file:src/formatter.ts",
      "kind": "file",
      "qualifiedName": "src/formatter.ts",
      "displayName": "formatter.ts",
      "canonicalIdentity": "node|file|src/formatter.ts",
      "entityKey": "2e88d3794109a8e3ff09c524bc458969cce8a7234d80e682c909b1b5e646362f",
      "file": "src/formatter.ts",
      "exported": false,
      "bodyHash": "28fcd7f76556011f3e862daece4240348db9c9d0a7edd98a2f0026907c4b1ef7"
    },
    {
      "id": "file:src/resolver.ts",
      "kind": "file",
      "qualifiedName": "src/resolver.ts",
      "displayName": "resolver.ts",
      "canonicalIdentity": "node|file|src/resolver.ts",
      "entityKey": "1cd2f225e5f1a017859ff85be9510615112adac4cddc8cdada8a812967fea660",
      "file": "src/resolver.ts",
      "exported": false,
      "bodyHash": "224d3daf701c18caeed2910f4d424414f84125afd298cce15c02a71238d66a95"
    },
    {
      "id": "file:src/legacy/helper.ts",
      "kind": "file",
      "qualifiedName": "src/legacy/helper.ts",
      "displayName": "helper.ts",
      "canonicalIdentity": "node|file|src/legacy/helper.ts",
      "entityKey": "7eefb78275275643ab29cadb1941da9f4b1d63dad065cd86040a4d9137b01c6e",
      "file": "src/legacy/helper.ts",
      "exported": false,
      "bodyHash": "f8c938469130d4b334a313898ec600256a5b9506df3c7f145195d485fd452481"
    },
    {
      "id": "class:audit.Audit",
      "kind": "class",
      "qualifiedName": "src/audit.ts.Audit",
      "displayName": "Audit",
      "canonicalIdentity": "node|class|src/audit.ts.Audit",
      "entityKey": "f50eec278304fe1d1758fe59d0b1fe6eb224674dedebc194e9976609ab206215",
      "file": "src/audit.ts",
      "exported": true,
      "bodyHash": "5324bc758d9e11b89c9cd5e3721ae650ea868a137576de966653f0618a9d33ec"
    },
    {
      "id": "method:audit.Audit.record",
      "kind": "method",
      "qualifiedName": "src/audit.ts.Audit.record",
      "displayName": "record",
      "canonicalIdentity": "node|method|src/audit.ts.Audit.record",
      "entityKey": "57338bba507091f59a91f9ee47b3cb500fb45a7da476ee46afe23a67f74211c6",
      "file": "src/audit.ts",
      "exported": false,
      "bodyHash": "80a406b7c83a8d6cbd6d6875f1166ae26b6e029e3a3aac22931a884e5a87d2dd"
    },
    {
      "id": "class:notifier.Notifier",
      "kind": "class",
      "qualifiedName": "src/notifier.ts.Notifier",
      "displayName": "Notifier",
      "canonicalIdentity": "node|class|src/notifier.ts.Notifier",
      "entityKey": "9b15237b3ef926de4e325a2df727002bcd6262fb0a24e5c61577323182599a12",
      "file": "src/notifier.ts",
      "exported": true,
      "bodyHash": "9b4b97e5bf773f090fe7167c2d03aa29cb74c5f7ff5bcb9b899ad7a5a44b63a8"
    },
    {
      "id": "method:notifier.Notifier.send",
      "kind": "method",
      "qualifiedName": "src/notifier.ts.Notifier.send",
      "displayName": "send",
      "canonicalIdentity": "node|method|src/notifier.ts.Notifier.send",
      "entityKey": "613d8834dd7359a0b0cae9171dd20d19cdb8f83f245e846763ca29595aaa5d72",
      "file": "src/notifier.ts",
      "exported": false,
      "bodyHash": "334ee150016f83156514e3aaa217ce91b231a1c71b04f1d72a40fdd0fca69966"
    },
    {
      "id": "class:formatter.Formatter",
      "kind": "class",
      "qualifiedName": "src/formatter.ts.Formatter",
      "displayName": "Formatter",
      "canonicalIdentity": "node|class|src/formatter.ts.Formatter",
      "entityKey": "81ee30875bbb77eb25ef1e69de2b58108c45f3906be6f68f8b5feff41065ea25",
      "file": "src/formatter.ts",
      "exported": true,
      "bodyHash": "b4c54e2c4ff4f0edf14354046c979d836057c02076eb7f608c6d33de42e2e996"
    },
    {
      "id": "method:formatter.formatValue",
      "kind": "method",
      "qualifiedName": "src/formatter.ts.Formatter.formatValue",
      "displayName": "formatValue",
      "canonicalIdentity": "node|method|src/formatter.ts.Formatter.formatValue",
      "entityKey": "51e26ca25d7e0b4afa39801858aa4c4bbc6cdc55c08fb154e44d601564b1069d",
      "file": "src/formatter.ts",
      "exported": false,
      "bodyHash": "9354bf5c0bd818237932b1a5585ebbfe1b0be901cb570e9b78a71f3860160ab4"
    },
    {
      "id": "class:resolver.Resolver",
      "kind": "class",
      "qualifiedName": "src/resolver.ts.Resolver",
      "displayName": "Resolver",
      "canonicalIdentity": "node|class|src/resolver.ts.Resolver",
      "entityKey": "87c3a9377db4a6780672a12a59a0b615b8e3ee70aee2a0327517082298e6d984",
      "file": "src/resolver.ts",
      "exported": true,
      "bodyHash": "24b52e8c4c3dcd6e0f44fa94385761c8fee880589107bcd58322967873a82688"
    },
    {
      "id": "method:resolver.Resolver.resolve",
      "kind": "method",
      "qualifiedName": "src/resolver.ts.Resolver.resolve",
      "displayName": "resolve",
      "canonicalIdentity": "node|method|src/resolver.ts.Resolver.resolve",
      "entityKey": "06ebd1de7b45f0335eac9523256ffdfe6f04f3ff59ad22fe666a5cd975234091",
      "file": "src/resolver.ts",
      "exported": false,
      "bodyHash": "f301e67a7bfc69dc8fe7ce51b5decda3206772ff74160f6ecafb36296ff59fc2"
    },
    {
      "id": "fn:helper.normalize.old",
      "kind": "function",
      "qualifiedName": "src/legacy/helper.ts.normalize",
      "displayName": "normalize",
      "canonicalIdentity": "node|function|src/legacy/helper.ts.normalize",
      "entityKey": "1da72e21f224ebbbe48aa4b7963b37d3970d7330282b551028fa00cce5083aa6",
      "file": "src/legacy/helper.ts",
      "exported": true,
      "bodyHash": "0e22fe4531b527c419a37773660372d2566b2586e730a994ce6440e769c9d3e5"
    },
    {
      "id": "fn:task.processTask",
      "kind": "function",
      "qualifiedName": "src/task.ts.processTask",
      "displayName": "processTask",
      "canonicalIdentity": "node|function|src/task.ts.processTask",
      "entityKey": "570344b711fd4cea1238a03ce8f117ae92efe07a19183859848f69bd2016198b",
      "file": "src/task.ts",
      "exported": true,
      "bodyHash": "6a4c4b8155c85dbedade848ea8296215bae2c39b54ac5a0fa50fdbad4595fc68"
    }
  ],
  "edges": [
    {
      "id": "edge:002",
      "src": "pkg:root",
      "relation": "contains",
      "dst": "file:src/task.ts",
      "canonicalIdentity": "edge|b6d828141f3d2c67045e16e8311a82251a9abb5d7626a7f129c0590e61391a11|contains|7597f6a1fedf2bf59237174bb751f46d1c25869a2dea649daa88e133eaf686ed",
      "entityKey": "9ceee7ea33bc11e902debd7492e63007a5823e5d6d52a309a69ee8bc27e68536",
      "origin": "compiler",
      "confidence": "certain",
      "resolution": "resolved",
      "evidence": [
        {
          "file": "src/task.ts",
          "line": 1,
          "contains": "import { Audit } from \"./audit.js\";"
        }
      ]
    },
    {
      "id": "edge:004",
      "src": "pkg:root",
      "relation": "contains",
      "dst": "file:src/audit.ts",
      "canonicalIdentity": "edge|b6d828141f3d2c67045e16e8311a82251a9abb5d7626a7f129c0590e61391a11|contains|0afb134943a90ce07f837cebac18849b2a8e9ecf9a892324dcbaf230c9f225ad",
      "entityKey": "86ed30589b4dd3284234c0108b79222ecc007abccff2dd90168f93f4d14aa653",
      "origin": "compiler",
      "confidence": "certain",
      "resolution": "resolved",
      "evidence": [
        {
          "file": "src/audit.ts",
          "line": 1,
          "contains": "export class Audit {"
        }
      ]
    },
    {
      "id": "edge:006",
      "src": "pkg:root",
      "relation": "contains",
      "dst": "file:src/notifier.ts",